{
  "id": "research",
  "version": 1,
  "status": "draft",
  "createdAt": "2026-04-27",
  "updatedAt": "2026-04-28",
  "route": "/research",
  "pagePattern": "analytical-overview",
  "shellFamily": "analytical",
  "prototypeRef": "docs/designs/specs/prototypes/page-research.html",
  "landing": {
    "reactRouteStatus": "implemented",
    "featureModule": "src/features/research",
    "contractStatus": "draft",
    "overlayStatus": "triggerable",
    "visualAuditStatus": "missing"
  },
  "viewports": [
    {
      "width": 1536,
      "height": 900,
      "role": "primary"
    },
    {
      "width": 1366,
      "height": 768,
      "role": "compact"
    }
  ],
  "slots": [
    {
      "name": "strip",
      "required": true,
      "prototypeSelector": ".shell-strip",
      "reactSelector": "[data-slot='strip']",
      "a11yRole": "banner",
      "responsiveBehavior": {
        "compact": "collapsed"
      }
    },
    {
      "name": "main",
      "required": true,
      "prototypeSelector": ".shell-main",
      "reactSelector": "[data-slot='main']",
      "a11yRole": "main"
    },
    {
      "name": "activity",
      "required": true,
      "prototypeSelector": ".shell-activity",
      "reactSelector": "[data-slot='activity']",
      "a11yRole": "complementary",
      "responsiveBehavior": {
        "compact": "collapsed"
      }
    },
    {
      "name": "analysis",
      "required": true,
      "prototypeSelector": ".shell-analysis",
      "reactSelector": "[data-slot='analysis']",
      "a11yRole": "complementary",
      "responsiveBehavior": {
        "compact": "overlay"
      }
    }
  ],
  "states": {
    "universal": [
      "loading",
      "empty",
      "error",
      "stale"
    ],
    "pageSpecific": [
      "no-runs"
    ]
  },
  "flags": {
    "hasStatusBar": false,
    "sidebarCollapsible": false
  },
  "metrics": {
    "capturedAt": "2026-04-27",
    "viewport": "1536x900",
    "baseline": {
      "strip": {
        "width": 1536,
        "height": 72,
        "strategy": "content-driven"
      },
      "main": {
        "width": 980,
        "height": 720,
        "strategy": "content-driven"
      },
      "activity": {
        "width": 280,
        "height": 720,
        "strategy": "fixed-width"
      },
      "analysis": {
        "width": 280,
        "height": 720,
        "strategy": "fixed-width"
      }
    }
  },
  "visualThresholds": {
    "consoleErrors": 0,
    "pageErrors": 0,
    "missingSelectors": 0,
    "targetMismatch": 0,
    "pixelDiffRatio": 0.02
  },
  "overlays": [
    {
      "id": "research.new-backtest",
      "kind": "sheet",
      "blocking": false,
      "requiredInDefaultFlow": true,
      "trigger": {
        "slot": "main",
        "action": "open-overlay"
      },
      "prototypeSelector": "[data-overlay='overlay-new-backtest']",
      "reactComponent": "PrototypeOnlyOverlay",
      "closeBehavior": [
        "escape",
        "outside-click",
        "primary-action"
      ]
    },
    {
      "id": "research.new-strategy",
      "kind": "sheet",
      "blocking": false,
      "requiredInDefaultFlow": true,
      "trigger": {
        "slot": "main",
        "action": "open-overlay"
      },
      "prototypeSelector": "[data-overlay='overlay-new-strategy']",
      "reactComponent": "PrototypeOnlyOverlay",
      "closeBehavior": [
        "escape",
        "outside-click",
        "primary-action"
      ]
    },
    {
      "id": "research.new-experiment",
      "kind": "sheet",
      "blocking": false,
      "requiredInDefaultFlow": true,
      "trigger": {
        "slot": "main",
        "action": "open-overlay"
      },
      "prototypeSelector": "[data-overlay='overlay-new-experiment']",
      "reactComponent": "PrototypeOnlyOverlay",
      "closeBehavior": [
        "escape",
        "outside-click",
        "primary-action"
      ]
    },
    {
      "id": "research.run-detail",
      "kind": "drawer",
      "blocking": false,
      "requiredInDefaultFlow": true,
      "trigger": {
        "slot": "main",
        "action": "open-overlay"
      },
      "prototypeSelector": "[data-overlay='overlay-run-detail']",
      "reactComponent": "PrototypeOnlyOverlay",
      "closeBehavior": [
        "escape",
        "outside-click",
        "primary-action"
      ]
    },
    {
      "id": "research.review-action",
      "kind": "drawer",
      "blocking": false,
      "requiredInDefaultFlow": true,
      "trigger": {
        "slot": "main",
        "action": "open-overlay"
      },
      "prototypeSelector": "[data-overlay='overlay-review-action']",
      "reactComponent": "PrototypeOnlyOverlay",
      "closeBehavior": [
        "escape",
        "outside-click",
        "primary-action"
      ]
    }
  ]
}
