{
  "id": "instrument-hub",
  "version": 1,
  "status": "draft",
  "createdAt": "2026-04-27",
  "updatedAt": "2026-04-28",
  "route": "/instruments/$id",
  "pagePattern": "object-hub",
  "shellFamily": "object-hub",
  "prototypeRef": "docs/designs/specs/prototypes/page-instrument-hub.html",
  "landing": {
    "reactRouteStatus": "implemented",
    "featureModule": "src/features/instruments",
    "contractStatus": "draft",
    "overlayStatus": "triggerable",
    "visualAuditStatus": "queued",
    "reactTestRefs": [
      "src/features/instruments/components/info-level-annotations.test.tsx",
      "src/features/instruments/components/instrument-components.test.tsx"
    ],
    "reactComponentRefs": [
      "InstrumentHubPage"
    ]
  },
  "viewports": [
    {
      "width": 1536,
      "height": 900,
      "role": "primary"
    },
    {
      "width": 1366,
      "height": 768,
      "role": "compact"
    }
  ],
  "slots": [
    {
      "name": "meta",
      "required": true,
      "prototypeSelector": ".object-meta",
      "reactSelector": "[data-slot='meta']",
      "a11yRole": "banner",
      "responsiveBehavior": {
        "compact": "reflow"
      }
    },
    {
      "name": "tabs",
      "required": true,
      "prototypeSelector": ".object-tabs",
      "reactSelector": "[data-slot='tabs']",
      "a11yRole": "navigation",
      "responsiveBehavior": {
        "compact": "reflow"
      }
    },
    {
      "name": "main",
      "required": true,
      "prototypeSelector": ".object-main",
      "reactSelector": "[data-slot='main']",
      "a11yRole": "main"
    },
    {
      "name": "bottom",
      "required": true,
      "prototypeSelector": ".object-bottom",
      "reactSelector": "[data-slot='bottom']",
      "a11yRole": "region",
      "responsiveBehavior": {
        "compact": "collapsed"
      }
    }
  ],
  "states": {
    "universal": [
      "loading",
      "empty",
      "error",
      "stale"
    ],
    "pageSpecific": [
      "not-found"
    ]
  },
  "flags": {
    "hasStatusBar": true,
    "sidebarCollapsible": false
  },
  "metrics": {
    "capturedAt": "2026-04-27",
    "viewport": "1536x900",
    "baseline": {
      "meta": {
        "width": 1536,
        "height": 112,
        "strategy": "content-driven"
      },
      "tabs": {
        "width": 1536,
        "height": 48,
        "strategy": "content-driven"
      },
      "main": {
        "width": 1536,
        "height": 590,
        "strategy": "content-driven"
      },
      "bottom": {
        "width": 1536,
        "height": 140,
        "strategy": "content-driven"
      }
    }
  },
  "visualThresholds": {
    "consoleErrors": 0,
    "pageErrors": 0,
    "missingSelectors": 0,
    "targetMismatch": 0,
    "pixelDiffRatio": 0.02
  },
  "overlays": [
    {
      "id": "instrument-hub.chart-toolbar",
      "kind": "drawer",
      "blocking": false,
      "requiredInDefaultFlow": true,
      "trigger": {
        "slot": "main",
        "action": "open-overlay"
      },
      "prototypeSelector": "#overlay-chart-toolbar",
      "reactComponent": "PrototypeOnlyOverlay",
      "closeBehavior": [
        "escape",
        "outside-click",
        "primary-action"
      ]
    },
    {
      "id": "instrument-hub.news-detail",
      "kind": "drawer",
      "blocking": false,
      "requiredInDefaultFlow": true,
      "trigger": {
        "slot": "main",
        "action": "open-overlay"
      },
      "prototypeSelector": "#overlay-news-detail",
      "reactComponent": "PrototypeOnlyOverlay",
      "closeBehavior": [
        "escape",
        "outside-click",
        "primary-action"
      ]
    },
    {
      "id": "instrument-hub.announcement-detail",
      "kind": "drawer",
      "blocking": false,
      "requiredInDefaultFlow": true,
      "trigger": {
        "slot": "main",
        "action": "open-overlay"
      },
      "prototypeSelector": "#overlay-announcement-detail",
      "reactComponent": "PrototypeOnlyOverlay",
      "closeBehavior": [
        "escape",
        "outside-click",
        "primary-action"
      ]
    },
    {
      "id": "instrument-hub.add-watchlist",
      "kind": "drawer",
      "blocking": false,
      "requiredInDefaultFlow": true,
      "trigger": {
        "slot": "main",
        "action": "open-overlay"
      },
      "prototypeSelector": "#overlay-add-watchlist",
      "reactComponent": "PrototypeOnlyOverlay",
      "closeBehavior": [
        "escape",
        "outside-click",
        "primary-action"
      ]
    },
    {
      "id": "instrument-hub.send-research",
      "kind": "drawer",
      "blocking": false,
      "requiredInDefaultFlow": true,
      "trigger": {
        "slot": "main",
        "action": "open-overlay"
      },
      "prototypeSelector": "#overlay-send-research",
      "reactComponent": "PrototypeOnlyOverlay",
      "closeBehavior": [
        "escape",
        "outside-click",
        "primary-action"
      ]
    },
    {
      "id": "instrument-hub.halt-detail",
      "kind": "drawer",
      "blocking": false,
      "requiredInDefaultFlow": true,
      "trigger": {
        "slot": "main",
        "action": "open-overlay"
      },
      "prototypeSelector": "#overlay-halt-detail",
      "reactComponent": "PrototypeOnlyOverlay",
      "closeBehavior": [
        "escape",
        "outside-click",
        "primary-action"
      ]
    }
  ]
}
