{
  "id": "markets-screener",
  "version": 1,
  "status": "draft",
  "createdAt": "2026-04-27",
  "updatedAt": "2026-04-28",
  "route": "/markets/screener",
  "pagePattern": "catalog-screener",
  "shellFamily": "catalog",
  "prototypeRef": "docs/designs/specs/prototypes/page-markets-screener.html",
  "landing": {
    "reactRouteStatus": "implemented",
    "featureModule": "src/features/screener",
    "contractStatus": "draft",
    "overlayStatus": "triggerable",
    "visualAuditStatus": "verified",
    "reactTestRefs": [
      "src/features/screener/components/info-level-annotations.test.tsx",
      "src/features/screener/components/screener-components.test.tsx"
    ],
    "reactComponentRefs": [
      "ScreenerPage"
    ]
  },
  "viewports": [
    {
      "width": 1536,
      "height": 900,
      "role": "primary"
    },
    {
      "width": 1366,
      "height": 768,
      "role": "compact"
    }
  ],
  "slots": [
    {
      "name": "toolbar",
      "required": true,
      "prototypeSelector": ".shell-toolbar",
      "reactSelector": "[data-slot='toolbar']",
      "a11yRole": "region",
      "responsiveBehavior": {
        "compact": "collapsed"
      }
    },
    {
      "name": "main",
      "required": true,
      "prototypeSelector": ".shell-main",
      "reactSelector": "[data-slot='main']",
      "a11yRole": "main"
    },
    {
      "name": "detail",
      "required": true,
      "prototypeSelector": ".shell-detail",
      "reactSelector": "[data-slot='detail']",
      "a11yRole": "complementary",
      "responsiveBehavior": {
        "compact": "overlay"
      }
    }
  ],
  "states": {
    "universal": [
      "loading",
      "empty",
      "error",
      "stale"
    ],
    "pageSpecific": [
      "selected-row"
    ]
  },
  "flags": {
    "hasStatusBar": false,
    "sidebarCollapsible": false
  },
  "metrics": {
    "capturedAt": "2026-04-27",
    "viewport": "1536x900",
    "baseline": {
      "toolbar": {
        "width": 1536,
        "height": 64,
        "strategy": "content-driven"
      },
      "main": {
        "width": 1110,
        "height": 720,
        "strategy": "content-driven"
      },
      "detail": {
        "width": 360,
        "height": 720,
        "strategy": "fixed-width"
      }
    }
  },
  "visualThresholds": {
    "consoleErrors": 0,
    "pageErrors": 0,
    "missingSelectors": 0,
    "targetMismatch": 0,
    "pixelDiffRatio": 0.02
  },
  "overlays": [
    {
      "id": "markets-screener.save-preset",
      "kind": "modal",
      "blocking": true,
      "requiredInDefaultFlow": true,
      "trigger": {
        "slot": "main",
        "action": "open-overlay"
      },
      "prototypeSelector": "#overlay-save-preset",
      "reactComponent": "PrototypeOnlyOverlay",
      "closeBehavior": [
        "escape",
        "outside-click",
        "primary-action"
      ]
    },
    {
      "id": "markets-screener.column-manage",
      "kind": "sheet",
      "blocking": false,
      "requiredInDefaultFlow": true,
      "trigger": {
        "slot": "main",
        "action": "open-overlay"
      },
      "prototypeSelector": "#overlay-column-manage",
      "reactComponent": "PrototypeOnlyOverlay",
      "closeBehavior": [
        "escape",
        "outside-click",
        "primary-action"
      ]
    },
    {
      "id": "markets-screener.compare",
      "kind": "sheet",
      "blocking": false,
      "requiredInDefaultFlow": true,
      "trigger": {
        "slot": "main",
        "action": "open-overlay"
      },
      "prototypeSelector": "#overlay-compare",
      "reactComponent": "PrototypeOnlyOverlay",
      "closeBehavior": [
        "escape",
        "outside-click",
        "primary-action"
      ]
    },
    {
      "id": "markets-screener.generate-pool",
      "kind": "sheet",
      "blocking": false,
      "requiredInDefaultFlow": true,
      "trigger": {
        "slot": "main",
        "action": "open-overlay"
      },
      "prototypeSelector": "#overlay-generate-pool",
      "reactComponent": "PrototypeOnlyOverlay",
      "closeBehavior": [
        "escape",
        "outside-click",
        "primary-action"
      ]
    },
    {
      "id": "markets-screener.export",
      "kind": "drawer",
      "blocking": false,
      "requiredInDefaultFlow": true,
      "trigger": {
        "slot": "main",
        "action": "open-overlay"
      },
      "prototypeSelector": "#overlay-export",
      "reactComponent": "PrototypeOnlyOverlay",
      "closeBehavior": [
        "escape",
        "outside-click",
        "primary-action"
      ]
    }
  ]
}
